all_awardings,associated_award,author,author_flair_background_color,author_flair_css_class,author_flair_richtext,author_flair_template_id,author_flair_text,author_flair_text_color,author_flair_type,author_fullname,author_patreon_flair,author_premium,awarders,body,collapsed_because_crowd_control,collapsed_reason_code,comment_type,created_utc,gildings,id,is_submitter,link_id,locked,no_follow,parent_id,permalink,retrieved_on,score,send_replies,stickied,subreddit,subreddit_id,top_awarded_type,total_awards_received,treatment_tags,unrepliable_reason
[],,SnooCauliflowers3903,,,[],,,,text,t2_5xjmzurt,False,False,[],Day trip from Phoenix to Grand Canyon next weekend- what do we need to know,,,,1633757302,{},hfy5shf,False,t3_ptktqo,False,False,t1_hdxekmx,/r/phoenix/comments/ptktqo/canadian_visitor_near_vancouver_bc_planning_solo/hfy5shf/,1633884635,2,True,False,phoenix,t5_2qmpu,,0,[],
[],,SnooCauliflowers3903,,,[],,,,text,t2_5xjmzurt,False,False,[],Day trip from Phoenix to Grand Canyon next weekend- what do we need to know,,,,1633757255,{},hfy5q21,False,t3_q1djjn,False,True,t3_q1djjn,/r/phoenix/comments/q1djjn/instate_getaways_2nd_anniversary/hfy5q21/,1633884601,1,True,False,phoenix,t5_2qmpu,,0,[],
[],,SnooCauliflowers3903,,,[],,,,text,t2_5xjmzurt,False,False,[],Day trip from Phoenix to Grand Canyon next weekend- what do we need to know,,,,1633757226,{},hfy5ogo,False,t3_q3xw3g,False,True,t3_q3xw3g,/r/phoenix/comments/q3xw3g/rphoenix_daily_chat_friday_oct_08/hfy5ogo/,1633884576,3,True,False,phoenix,t5_2qmpu,,0,[],
[],,SnooCauliflowers3903,,,[],,,,text,t2_5xjmzurt,False,False,[],Does this agreement mean you can't use any other agent?,,,,1633753417,{},hfxzk0h,True,t3_q4dpn5,False,True,t1_hfxz4rb,/r/FirstTimeHomeBuyer/comments/q4dpn5/buyers_agreement_with_agent/hfxzk0h/,1633881149,1,True,False,FirstTimeHomeBuyer,t5_379e9,,0,[],
[],,SnooCauliflowers3903,,,[],,,,text,t2_5xjmzurt,False,False,[],I think you need enough for the down payment.,,,,1633751955,{},hfxwv9u,False,t3_q4djxu,False,False,t3_q4djxu,/r/FirstTimeHomeBuyer/comments/q4djxu/how_much_is_enough_to_have_saved_to_start_house/hfxwv9u/,1633879674,11,True,False,FirstTimeHomeBuyer,t5_379e9,,0,[],




all_awardings,archived,associated_award,author,author_flair_background_color,author_flair_css_class,author_flair_richtext,author_flair_template_id,author_flair_text,author_flair_text_color,author_flair_type,author_fullname,author_patreon_flair,author_premium,body,body_sha1,can_gild,collapsed,collapsed_because_crowd_control,collapsed_reason,collapsed_reason_code,comment_type,controversiality,created_utc,distinguished,gilded,gildings,id,is_submitter,link_id,locked,no_follow,parent_id,permalink,retrieved_utc,score,score_hidden,send_replies,stickied,subreddit,subreddit_id,subreddit_name_prefixed,subreddit_type,top_awarded_type,total_awards_received,treatment_tags,unrepliable_reason,awarders,retrieved_on
[],False,,ExpensiveGrace,,,[],,,,text,t2_j5i3a2wj,False,False,"&gt;They don’t even try it on men because they want the men to admire them. These traits are not admirable, and they know it.

They don't try it on men because this whole thing is about getting men and blocking other women from getting those men. Notice how they will give men pats on the back if they treat the other women as playthings and them as wifeys. 

&gt;Attain enough power through your own merit (which will be naturally higher as a non-Fe user) to be able to control when and where you interact with them.

&gt;Be ready when you interact, and dish it out just as much as they do. Watch them on a day you are choosing to interact, and determine what, on that day, they are feeling insecure about. Could be a bad hair day, an ill fitting sweater. It WILL be trivial (it would be cruel to pick on a real weakness anyway). Find the insecurity and point it out, always with “plausible deniability”.

Depends on the environment. If everyone else is like them or supports their antics you won't get away with it. This is why it's important to choose your workplace and your battles carefuly. You shouldn't engage them if there aren't enough neutral people or people who are against them. Usually if you are good then the more your workplace cares about profit the better for you and the worse for them.",6eec7eb78c7b0d3d1c4703460711decf72c1a6b3,True,False,,,,,0.0,1646335108,,0.0,{},hz7xp9v,False,t3_t5gtcu,False,True,t1_hz7hglo,/r/FemaleLevelUpStrategy/comments/t5gtcu/update_how_to_do_business_with_mean_girls_in_the/hz7xp9v/,1646335123.0,1,False,True,False,FemaleLevelUpStrategy,t5_2c0k6s,r/FemaleLevelUpStrategy,public,,0,[],,,
[],False,,ExpensiveGrace,,,[],,,,text,t2_j5i3a2wj,False,False,Hardly. The world is full of Serena Joys and Regina Georges.,f98a9e29da2879a5f7ff4340f9c4a5f8ed2ef6cd,True,False,,,,,0.0,1646328829,,0.0,{},hz7hacq,False,t3_t5gtcu,False,True,t1_hz787iz,/r/FemaleLevelUpStrategy/comments/t5gtcu/update_how_to_do_business_with_mean_girls_in_the/hz7hacq/,1646328845.0,1,False,True,False,FemaleLevelUpStrategy,t5_2c0k6s,r/FemaleLevelUpStrategy,public,,0,[],,,
[],False,,ExpensiveGrace,,,[],,,,text,t2_j5i3a2wj,False,False,Women like that shouldn't have as much power as they do. The fact that they exist and get away with so much shit really shows you how the game is rigged.,d2d7bcc0e1600ddd27a16bff846f83729a63a7c1,True,False,,,,,0.0,1646305168,,0.0,{},hz63ad7,False,t3_t5gtcu,False,True,t3_t5gtcu,/r/FemaleLevelUpStrategy/comments/t5gtcu/update_how_to_do_business_with_mean_girls_in_the/hz63ad7/,1646305180.0,1,False,True,False,FemaleLevelUpStrategy,t5_2c0k6s,r/FemaleLevelUpStrategy,public,,0,[],,,
[],,,ExpensiveGrace,,,[],,,,text,t2_j5i3a2wj,False,False,It's the same BS in Portugal. One option is ordering one from amazon. I found this one [https://www.amazon.com/Mint-Mobile-Starter-Verify-Compatibility/dp/B0786RD524/ref=sr\_1\_7\_sspa?keywords=Prepaid+Cell+Phone+Cards&amp;qid=1646089095&amp;sr=8-7-spons&amp;psc=1&amp;spLa=ZW5jcnlwdGVkUXVhbGlmaWVyPUFBUllDVUIwUldGOTgmZW5jcnlwdGVkSWQ9QTAzNjkwNjQyU0ExRjVRUUwwNE5EJmVuY3J5cHRlZEFkSWQ9QTA1MTgzNjMzSkhDNFJTTFJGTjk3JndpZGdldE5hbWU9c3BfbXRmJmFjdGlvbj1jbGlja1JlZGlyZWN0JmRvTm90TG9nQ2xpY2s9dHJ1ZQ==](https://www.amazon.com/Mint-Mobile-Starter-Verify-Compatibility/dp/B0786RD524/ref=sr_1_7_sspa?keywords=Prepaid+Cell+Phone+Cards&amp;qid=1646089095&amp;sr=8-7-spons&amp;psc=1&amp;spLa=ZW5jcnlwdGVkUXVhbGlmaWVyPUFBUllDVUIwUldGOTgmZW5jcnlwdGVkSWQ9QTAzNjkwNjQyU0ExRjVRUUwwNE5EJmVuY3J5cHRlZEFkSWQ9QTA1MTgzNjMzSkhDNFJTTFJGTjk3JndpZGdldE5hbWU9c3BfbXRmJmFjdGlvbj1jbGlja1JlZGlyZWN0JmRvTm90TG9nQ2xpY2s9dHJ1ZQ==) I don't know if it is good or not. In Portugal I found there's Lycamobile which can be bought in places like gas stations and supermarkets. I've never seen it or tried it but I will take a look.,,,,,,,,,1646089521,,,{},hyuaq9x,False,t3_t1ai8n,False,False,t1_hyhyy4p,/r/OSINT/comments/t1ai8n/how_can_i_create_a_discord_account_without_giving/hyuaq9x/,,1,,True,False,OSINT,t5_2qln3,,,,0,[],,[],1656235957.0
[],,,ExpensiveGrace,,,[],,,,text,t2_j5i3a2wj,False,False,I feel the same as you do. Coming to terms with it will make you stronger.,,,,,,,,,1646055118,,,{},hyrxk79,False,t3_t3fd6w,False,False,t3_t3fd6w,/r/FemaleDatingStrategy/comments/t3fd6w/am_i_the_only_one_whos_starting_to_believe_ill/hyrxk79/,,35,,True,False,FemaleDatingStrategy,t5_xaiot,,,,0,[],,[],1655908934.0
all_awardings,archived,associated_award,author,author_flair_background_color,author_flair_css_class,author_flair_richtext,author_flair_template_id,author_flair_text,author_flair_text_color,author_flair_type,author_fullname,author_patreon_flair,author_premium,body,body_sha1,can_gild,collapsed,collapsed_because_crowd_control,collapsed_reason,collapsed_reason_code,comment_type,controversiality,created_utc,distinguished,gilded,gildings,id,is_submitter,link_id,locked,no_follow,parent_id,permalink,retrieved_utc,score,score_hidden,send_replies,stickied,subreddit,subreddit_id,subreddit_name_prefixed,subreddit_type,top_awarded_type,total_awards_received,treatment_tags,unrepliable_reason,awarders,retrieved_on
[],False,,ExpensiveGrace,,,[],,,,text,t2_j5i3a2wj,False,False,"&gt;They don’t even try it on men because they want the men to admire them. These traits are not admirable, and they know it.

They don't try it on men because this whole thing is about getting men and blocking other women from getting those men. Notice how they will give men pats on the back if they treat the other women as playthings and them as wifeys. 

&gt;Attain enough power through your own merit (which will be naturally higher as a non-Fe user) to be able to control when and where you interact with them.

&gt;Be ready when you interact, and dish it out just as much as they do. Watch them on a day you are choosing to interact, and determine what, on that day, they are feeling insecure about. Could be a bad hair day, an ill fitting sweater. It WILL be trivial (it would be cruel to pick on a real weakness anyway). Find the insecurity and point it out, always with “plausible deniability”.

Depends on the environment. If everyone else is like them or supports their antics you won't get away with it. This is why it's important to choose your workplace and your battles carefuly. You shouldn't engage them if there aren't enough neutral people or people who are against them. Usually if you are good then the more your workplace cares about profit the better for you and the worse for them.",6eec7eb78c7b0d3d1c4703460711decf72c1a6b3,True,False,,,,,0.0,1646335108,,0.0,{},hz7xp9v,False,t3_t5gtcu,False,True,t1_hz7hglo,/r/FemaleLevelUpStrategy/comments/t5gtcu/update_how_to_do_business_with_mean_girls_in_the/hz7xp9v/,1646335123.0,1,False,True,False,FemaleLevelUpStrategy,t5_2c0k6s,r/FemaleLevelUpStrategy,public,,0,[],,,
[],False,,ExpensiveGrace,,,[],,,,text,t2_j5i3a2wj,False,False,Hardly. The world is full of Serena Joys and Regina Georges.,f98a9e29da2879a5f7ff4340f9c4a5f8ed2ef6cd,True,False,,,,,0.0,1646328829,,0.0,{},hz7hacq,False,t3_t5gtcu,False,True,t1_hz787iz,/r/FemaleLevelUpStrategy/comments/t5gtcu/update_how_to_do_business_with_mean_girls_in_the/hz7hacq/,1646328845.0,1,False,True,False,FemaleLevelUpStrategy,t5_2c0k6s,r/FemaleLevelUpStrategy,public,,0,[],,,
[],False,,ExpensiveGrace,,,[],,,,text,t2_j5i3a2wj,False,False,Women like that shouldn't have as much power as they do. The fact that they exist and get away with so much shit really shows you how the game is rigged.,d2d7bcc0e1600ddd27a16bff846f83729a63a7c1,True,False,,,,,0.0,1646305168,,0.0,{},hz63ad7,False,t3_t5gtcu,False,True,t3_t5gtcu,/r/FemaleLevelUpStrategy/comments/t5gtcu/update_how_to_do_business_with_mean_girls_in_the/hz63ad7/,1646305180.0,1,False,True,False,FemaleLevelUpStrategy,t5_2c0k6s,r/FemaleLevelUpStrategy,public,,0,[],,,
[],,,ExpensiveGrace,,,[],,,,text,t2_j5i3a2wj,False,False,It's the same BS in Portugal. One option is ordering one from amazon. I found this one [https://www.amazon.com/Mint-Mobile-Starter-Verify-Compatibility/dp/B0786RD524/ref=sr\_1\_7\_sspa?keywords=Prepaid+Cell+Phone+Cards&amp;qid=1646089095&amp;sr=8-7-spons&amp;psc=1&amp;spLa=ZW5jcnlwdGVkUXVhbGlmaWVyPUFBUllDVUIwUldGOTgmZW5jcnlwdGVkSWQ9QTAzNjkwNjQyU0ExRjVRUUwwNE5EJmVuY3J5cHRlZEFkSWQ9QTA1MTgzNjMzSkhDNFJTTFJGTjk3JndpZGdldE5hbWU9c3BfbXRmJmFjdGlvbj1jbGlja1JlZGlyZWN0JmRvTm90TG9nQ2xpY2s9dHJ1ZQ==](https://www.amazon.com/Mint-Mobile-Starter-Verify-Compatibility/dp/B0786RD524/ref=sr_1_7_sspa?keywords=Prepaid+Cell+Phone+Cards&amp;qid=1646089095&amp;sr=8-7-spons&amp;psc=1&amp;spLa=ZW5jcnlwdGVkUXVhbGlmaWVyPUFBUllDVUIwUldGOTgmZW5jcnlwdGVkSWQ9QTAzNjkwNjQyU0ExRjVRUUwwNE5EJmVuY3J5cHRlZEFkSWQ9QTA1MTgzNjMzSkhDNFJTTFJGTjk3JndpZGdldE5hbWU9c3BfbXRmJmFjdGlvbj1jbGlja1JlZGlyZWN0JmRvTm90TG9nQ2xpY2s9dHJ1ZQ==) I don't know if it is good or not. In Portugal I found there's Lycamobile which can be bought in places like gas stations and supermarkets. I've never seen it or tried it but I will take a look.,,,,,,,,,1646089521,,,{},hyuaq9x,False,t3_t1ai8n,False,False,t1_hyhyy4p,/r/OSINT/comments/t1ai8n/how_can_i_create_a_discord_account_without_giving/hyuaq9x/,,1,,True,False,OSINT,t5_2qln3,,,,0,[],,[],1656235957.0
[],,,ExpensiveGrace,,,[],,,,text,t2_j5i3a2wj,False,False,I feel the same as you do. Coming to terms with it will make you stronger.,,,,,,,,,1646055118,,,{},hyrxk79,False,t3_t3fd6w,False,False,t3_t3fd6w,/r/FemaleDatingStrategy/comments/t3fd6w/am_i_the_only_one_whos_starting_to_believe_ill/hyrxk79/,,35,,True,False,FemaleDatingStrategy,t5_xaiot,,,,0,[],,[],1655908934.0
all_awardings,archived,associated_award,author,author_flair_background_color,author_flair_css_class,author_flair_richtext,author_flair_template_id,author_flair_text,author_flair_text_color,author_flair_type,author_fullname,author_patreon_flair,author_premium,body,body_sha1,can_gild,collapsed,collapsed_because_crowd_control,collapsed_reason,collapsed_reason_code,comment_type,controversiality,created_utc,distinguished,gilded,gildings,id,is_submitter,link_id,locked,no_follow,parent_id,permalink,retrieved_utc,score,score_hidden,send_replies,stickied,subreddit,subreddit_id,subreddit_name_prefixed,subreddit_type,top_awarded_type,total_awards_received,treatment_tags,unrepliable_reason,awarders,retrieved_on
[],False,,Frogspocket,#24a0ed,Coach,[],abcb97fa-f8df-11e9-b9c6-0ede9112c558,FDS STRATEGY COACH,dark,text,t2_7osmnunj,False,False,"This is great advice!!! I'm hoping other women here have ""homework"" ideas to share too because I love learning new ones. It can feel a little silly or even awkward to be sitting there doing dating homework 🤓 lol. But honestly it's a fantastic thing to do.",eed1a5c1547aec2d4a6546fc0972612e288a9e12,True,False,,,,,0.0,1633714781,,0.0,{},hfvne6i,True,t3_q41iu5,False,False,t1_hfvlahd,/r/FemaleDatingStrategy/comments/q41iu5/having_and_defining_your_own_standards_is_a_great/hfvne6i/,1633714794.0,1,False,True,False,FemaleDatingStrategy,t5_xaiot,r/FemaleDatingStrategy,public,,0,[],,,
[],False,,Frogspocket,#24a0ed,Coach,[],abcb97fa-f8df-11e9-b9c6-0ede9112c558,FDS STRATEGY COACH,dark,text,t2_7osmnunj,False,False,ooh that's an interesting one. i'll have to think through that one myself!,67b3275ae67aab3a4c669c9013a6486df711b078,True,False,,,,,0.0,1633712077,,0.0,{},hfvgvj7,True,t3_q41iu5,False,True,t1_hfvfyfd,/r/FemaleDatingStrategy/comments/q41iu5/having_and_defining_your_own_standards_is_a_great/hfvgvj7/,1633712091.0,1,False,True,False,FemaleDatingStrategy,t5_xaiot,r/FemaleDatingStrategy,public,,0,[],,,
[],False,,Frogspocket,#24a0ed,Coach,[],abcb97fa-f8df-11e9-b9c6-0ede9112c558,FDS STRATEGY COACH,dark,text,t2_7osmnunj,False,False,"i'm someone who has had posts removed by mods before, but i've learned that there is definitely a method to their madness. i started to understand WHY they delete the things they delete and the reason is really boring and undramatic: it's because the content just doesn't align with the sub. so it doesn't bother me when they delete THOSE posts (including my own). they have an eye for what fits and what doesn't.

the thing that bothers me is when they delete criticisms about the sub instead of just letting us talk it out from time to time. maybe we need some kind of weekly meta thread if there isn't one already? i agree with you completely that we can handle it here. we can critically engage with one another in a healthy way. we've proved over and over again that we stay respectful with each other here while we argue. so as long as we stay aligned with the sub's goals while we critique each other it (and it doesn't spiral out into petty fights) it makes no sense that it's all burried and silenced. very frustrating",049ea1c946ba6a86b4a69c01edf893f66c9c2b82,True,False,,,,,0.0,1633711993,,0.0,{},hfvgo4y,False,t3_q3vdnl,False,True,t3_q3vdnl,/r/FemaleDatingStrategy/comments/q3vdnl/this_post_will_probably_be_removed/hfvgo4y/,1633712010.0,1,False,True,False,FemaleDatingStrategy,t5_xaiot,r/FemaleDatingStrategy,public,,0,[],,,
[],False,,Frogspocket,#24a0ed,Coach,[],abcb97fa-f8df-11e9-b9c6-0ede9112c558,FDS STRATEGY COACH,dark,text,t2_7osmnunj,False,False,"I SINCERELY didn't have a preference for tall men until short men ruined their own reputation lol.

There's a myth that tall women are at a disadvantage when it comes to dating. Being a tall woman is the jackpot. Short women have to vet and learn the hard way that these insecure guys (like the one you met) suck. But these men show their cards right away to tall women. All you have to do is literally stand there (in heels or next to a taller man) and they do the vetting for you.

And tall men who are interested in tall women are literally the top shelf of hvm.",83da54e0c4b5375d7a06624bdbac99ff86a73443,True,False,,,,,0.0,1633548273,,0.0,{},hfn25n0,False,t3_q2jq5b,False,True,t3_q2jq5b,/r/FemaleDatingStrategy/comments/q2jq5b/im_done_with_men_shorter_than_me/hfn25n0/,1633548283.0,1,False,True,False,FemaleDatingStrategy,t5_xaiot,r/FemaleDatingStrategy,public,,0,[],,,
[],,,Frogspocket,#24a0ed,Coach,[],abcb97fa-f8df-11e9-b9c6-0ede9112c558,FDS STRATEGY COACH,dark,text,t2_7osmnunj,False,False,"I have the same type. I once had a friend get mad at me because I wasn't attracted to our mutual friend. He was cute but his hair line was receding (and his dad's was really bad) so I got spooked lol and i just couldn't feign attraction for him. My friends literally tried gaslighting me by telling me I was probably just a lesbian because it wasn't ""normal"" to find most men ugly. Told I was being shallow for being (involuntarily) repulsed by balding. It's rough our there, I can absolutely sympathize. Idk if it makes you feel better or just annoys you but I once made the exact same declaration as you but did end up finding my type eventually. It took years though.",,,,,,,,,1633452034,,,{},hfhwrx4,False,t3_q1aaye,False,False,t3_q1aaye,/r/FemaleDatingStrategy/comments/q1aaye/the_lack_of_attractive_men_out_there_is_so/hfhwrx4/,,9,,True,False,FemaleDatingStrategy,t5_xaiot,,,,0,[],,[],1633577725.0
all_awardings,associated_award,author,author_flair_background_color,author_flair_css_class,author_flair_richtext,author_flair_template_id,author_flair_text,author_flair_text_color,author_flair_type,author_fullname,author_patreon_flair,author_premium,awarders,body,collapsed_because_crowd_control,collapsed_reason_code,comment_type,created_utc,gildings,id,is_submitter,link_id,locked,no_follow,parent_id,permalink,retrieved_on,score,send_replies,stickied,subreddit,subreddit_id,top_awarded_type,total_awards_received,treatment_tags,unrepliable_reason
[],,-vvl,,,[],,,,text,t2_ek7jfadv,False,False,[],sure,,,,1633650488,{},hfsjq1o,False,t3_q1y82b,False,True,t3_q1y82b,/r/AsexualMen/comments/q1y82b/would_you_date_a_non_asexual_women_that_chooses/hfsjq1o/,1633779021,2,True,False,AsexualMen,t5_3a6r8,,0,[],
[],,Happy-nb-trans,,,[],,,,text,t2_8xpwzsf9,False,False,[],How come it says the survey is not currently active?… Is it me?,,,,1633618492,{},hfqgzaw,False,t3_q25vsx,False,True,t3_q25vsx,/r/AsexualMen/comments/q25vsx/survey_on_asexual_transgender_gender/hfqgzaw/,1633741945,1,True,False,AsexualMen,t5_3a6r8,,0,[],
[],,TwoFaceDevil,,,[],,,,text,t2_asg0glof,False,False,[],Very awkwardly,,,,1633568280,{},hfoa7r8,False,t3_pp925e,False,True,t3_pp925e,/r/AsexualMen/comments/pp925e/sorry_if_this_has_been_asked_before_but_how_do/hfoa7r8/,1633698658,1,True,False,AsexualMen,t5_3a6r8,,0,[],
[],,Bronztrooper,,AceMen,[],1f0bbefe-6eea-11e5-a399-0edc22c2349d,Asexual,dark,text,t2_4c7dnich,False,False,[],"I haven't had to deal with much discrimination either, but that's more due to the fact that I apparently give off straight vibes and I'm picky about who I mention being ace to irl.  I've seen a lot of stories of other ace people that deal with people trying to invalidate their asexuality and/or claiming that they can ""fix them"" much in the same way bi and pan people experience, so that alone gives us a solid connection with at least part of the LGBT+ community without even going into romantic orientations.  Not to mention that you'd think that many religious people would have no real problem with ace people, but some just find any reason to claim we either don't exist or somehow claim we're 'unnatural' simply due to not being straight.

And then there are the people in the LGBT+ community that claim we're either ""actually just straight and looking for attention"" or ""actually gay and have internalized homophobia"", which are comments that have been directed at bi/pan people as well.  Not the mention the old ""YoU CaN PaSs aS StRaIgHt!"" line to dismiss any issues we face and Oppression Olympics rhetoric.

The LGBT+ community isn't about how much oppression we face (if that was the case, LGBT+ people whose lives weren't negatively impacted due to being LGBT+ wouldn't be considered part of the community), it's about spreading awareness and acceptance for non-straight and non-cis identities as well as solidarity between those who aren't cishet.",,,,1633554009,{},hfnfry3,False,t3_q1y82b,False,True,t1_hfnd9mx,/r/AsexualMen/comments/q1y82b/would_you_date_a_non_asexual_women_that_chooses/hfnfry3/,1633683048,2,True,False,AsexualMen,t5_3a6r8,,0,[],
[],,ceitamiot,,,[],,,,text,t2_ioswc,False,False,[],"I don't really understand the LGBT bit. As an ace, I already kinda feel like I don't belong in there because I just don't see the same level of discrimination involved for someone who is gay or trans. Like, there's a guy in the corner who doesn't want to have sex, nobody cares. Or nobody has in my case. I feel strongly for my ace sisters who have to deal with frequent approaches, however.",,,,1633552940,{},hfnd9mx,False,t3_q1y82b,False,True,t1_hfk1gd4,/r/AsexualMen/comments/q1y82b/would_you_date_a_non_asexual_women_that_chooses/hfnd9mx/,1633681833,2,True,False,AsexualMen,t5_3a6r8,,0,[],


all_awardings,archived,associated_award,author,author_flair_background_color,author_flair_css_class,author_flair_richtext,author_flair_template_id,author_flair_text,author_flair_text_color,author_flair_type,author_fullname,author_patreon_flair,author_premium,body,body_sha1,can_gild,collapsed,collapsed_because_crowd_control,collapsed_reason,collapsed_reason_code,comment_type,controversiality,created_utc,distinguished,gilded,gildings,id,is_submitter,link_id,locked,no_follow,parent_id,permalink,retrieved_utc,score,score_hidden,send_replies,stickied,subreddit,subreddit_id,subreddit_name_prefixed,subreddit_type,top_awarded_type,total_awards_received,treatment_tags,unrepliable_reason
[],False,,thebelsnickle1991,,,[],,,,text,t2_600muuy8,False,True,It’s just the start.,932b01a7b86b95d18ce4c06dddbe98f0a05f7cdc,True,False,,,,,0,1661715336,,0,{},im5z8te,False,t3_x03x1y,False,True,t1_im5z3tf,/r/Barca/comments/x03x1y/postmatch_thread_fc_barcelona_vs_real_valladolid/im5z8te/,1661715350,1,True,False,False,Barca,t5_2s561,r/Barca,public,,0,[],
[],False,,thebelsnickle1991,transparent,,"[{'a': ':FC_Barcelona:', 'e': 'emoji', 'u': 'https://emoji.redditmedia.com/btr9lvxwkgd81_t5_2qi58/FC_Barcelona'}]",a8ad979e-7c07-11e9-b588-0e55aa3940a6,:FC_Barcelona:,dark,richtext,t2_600muuy8,False,True,Lewangoalski.,54fcd1e4129b407f903eeaf1bc40340a5df5e9ee,True,False,,,,,0,1661715093,,0,{},im5ynou,False,t3_x03pc2,False,True,t1_im5xth9,/r/soccer/comments/x03pc2/post_match_thread_barcelona_40_real_valladolid_la/im5ynou/,1661715111,1,True,False,False,soccer,t5_2qi58,r/soccer,public,,0,[],
[],False,,thebelsnickle1991,,,[],,,,text,t2_600muuy8,False,True,Looks corny.,25503debd64220a9ae44eb80ac4613c7958d847d,True,False,,,,,0,1661639518,,0,{},im24c36,False,t3_wzf5wm,False,True,t3_wzf5wm,/r/Damnthatsinteresting/comments/wzf5wm/forest_art_that_i_thought_was_pretty_cool/im24c36/,1661639529,1,False,False,False,Damnthatsinteresting,t5_2xxyj,r/Damnthatsinteresting,public,,0,[],
[],False,,thebelsnickle1991,transparent,,"[{'a': ':FC_Barcelona:', 'e': 'emoji', 'u': 'https://emoji.redditmedia.com/btr9lvxwkgd81_t5_2qi58/FC_Barcelona'}]",a8ad979e-7c07-11e9-b588-0e55aa3940a6,:FC_Barcelona:,dark,richtext,t2_600muuy8,False,True,"Yes, please.",202482320fd1fce9abccc3a32d7d87d5018bf30e,True,False,,,,,0,1661615263,,0,{},im0jj7w,False,t3_wz60fq,False,True,t1_im0j4wx,/r/soccer/comments/wz60fq/liverpool_9_0_bournemouth_luis_diaz_85/im0jj7w/,1661615276,1,True,True,False,soccer,t5_2qi58,r/soccer,public,,0,[],
[],False,,thebelsnickle1991,transparent,,"[{'a': ':FC_Barcelona:', 'e': 'emoji', 'u': 'https://emoji.redditmedia.com/btr9lvxwkgd81_t5_2qi58/FC_Barcelona'}]",a8ad979e-7c07-11e9-b588-0e55aa3940a6,:FC_Barcelona:,dark,richtext,t2_600muuy8,False,True,Inevitable.,8a00d2c2c01273aea6c728ca15ee3f626fe2a2ab,True,False,,,,,0,1661614947,,0,{},im0iqj2,False,t3_wz5y9x,False,True,t3_wz5y9x,/r/soccer/comments/wz5y9x/manchester_city_4_2_crystal_palace_erling_haaland/im0iqj2/,1661614960,1,True,False,False,soccer,t5_2qi58,r/soccer,public,,0,[],
[],False,,thebelsnickle1991,transparent,,"[{'a': ':FC_Barcelona:', 'e': 'emoji', 'u': 'https://emoji.redditmedia.com/btr9lvxwkgd81_t5_2qi58/FC_Barcelona'}]",a8ad979e-7c07-11e9-b588-0e55aa3940a6,:FC_Barcelona:,dark,richtext,t2_600muuy8,False,True,He’s a goal scoring machine.,0b173d73e9eb822e033166a1311e8152c950cffd,True,False,,,,,0,1661614540,,0,{},im0hqpn,False,t3_wz5p4n,False,True,t1_im0hf9w,/r/soccer/comments/wz5p4n/mancheste_city_3_2_crystal_palace_haaland_70/im0hqpn/,1661614559,1,True,False,False,soccer,t5_2qi58,r/soccer,public,,0,[],
[],False,,thebelsnickle1991,,,[],,,,text,t2_600muuy8,False,True,Iniesta vibes. Love it!,936d0364ab350b7c5b30b8bc79ef60eeae802bcc,True,False,,,,,0,1661283606,,0,{},ilhx9y1,False,t3_wvttpo,False,True,t3_wvttpo,/r/Barca/comments/wvttpo/pedri_vs_real_sociedad/ilhx9y1/,1661283624,1,True,False,False,Barca,t5_2s561,r/Barca,public,,0,[],
