all_awardings,associated_award,author,author_flair_background_color,author_flair_css_class,author_flair_richtext,author_flair_template_id,author_flair_text,author_flair_text_color,author_flair_type,author_fullname,author_patreon_flair,author_premium,awarders,body,collapsed_because_crowd_control,collapsed_reason_code,comment_type,created_utc,gildings,id,is_submitter,link_id,locked,no_follow,parent_id,permalink,retrieved_on,score,send_replies,stickied,subreddit,subreddit_id,top_awarded_type,total_awards_received,treatment_tags,unrepliable_reason
[],False,,thebelsnickle1991,transparent,,"[{'a': ':FC_Barcelona:', 'e': 'emoji', 'u': 'https://emoji.redditmedia.com/btr9lvxwkgd81_t5_2qi58/FC_Barcelona'}]",a8ad979e-7c07-11e9-b588-0e55aa3940a6,:FC_Barcelona:,dark,richtext,t2_600muuy8,False,True,Not really.,38a907a7fff5a3d11d34f4eea895f9cdd3c757e4,True,False,,,,,0,1661118932,,0,{},il8upvc,False,t3_wubekk,False,True,t1_il8uczb,/r/soccer/comments/wubekk/post_match_thread_real_sociedad_14_fc_barcelona/il8upvc/,1661118946,1,True,False,False,soccer,t5_2qi58,r/soccer,public,,0,[],
[],False,,thebelsnickle1991,transparent,,"[{'a': ':FC_Barcelona:', 'e': 'emoji', 'u': 'https://emoji.redditmedia.com/btr9lvxwkgd81_t5_2qi58/FC_Barcelona'}]",a8ad979e-7c07-11e9-b588-0e55aa3940a6,:FC_Barcelona:,dark,richtext,t2_600muuy8,False,True,Wasn’t an easy game though.,4c72de2940937e029cc7c848b7db4d3a9a152918,True,False,,,,,0,1661118192,,0,{},il8szao,False,t3_wub1qh,False,True,t1_il8s9ew,/r/soccer/comments/wub1qh/real_sociedad_1_4_barcelona_ansu_fati_79/il8szao/,1661118203,1,True,False,False,soccer,t5_2qi58,r/soccer,public,,0,[],
[],False,,thebelsnickle1991,,,[],,,,text,t2_600muuy8,False,True,Some hauntingly beautiful photos.,afe9dc4078d2fce8416294c8d4d9b997f6091a92,True,False,,,,,0,1661104723,,0,{},il7wq2f,False,t3_wu5otv,False,True,t3_wu5otv,/r/interestingasfuck/comments/wu5otv/the_danube_near_tutrakan_bulgaria_amid_europes/il7wq2f/,1661104738,1,True,True,False,interestingasfuck,t5_2qhsa,r/interestingasfuck,public,,0,[],
all_awardings,archived,associated_award,author,author_flair_background_color,author_flair_css_class,author_flair_richtext,author_flair_template_id,author_flair_text,author_flair_text_color,author_flair_type,author_fullname,author_patreon_flair,author_premium,body,body_sha1,can_gild,collapsed,collapsed_because_crowd_control,collapsed_reason,collapsed_reason_code,comment_type,controversiality,created_utc,distinguished,gilded,gildings,id,is_submitter,link_id,locked,no_follow,parent_id,permalink,retrieved_utc,score,score_hidden,send_replies,stickied,subreddit,subreddit_id,subreddit_name_prefixed,subreddit_type,top_awarded_type,total_awards_received,treatment_tags,unrepliable_reason
[],False,,Kooky-Scallion-9269,,,[],,,,text,t2_d72ftl83,False,False,"Just ghost them an move on. If you need to grieve or be angry, do so-- but I treat toxic women the same way I do toxic men: block and delete on all communication (including social media), sanitize anything about them from my life, and process any emotions I have on my own.",4368535eaeffeca484579ed066110574a76068a4,True,False,,,,,0,1640075331,,0,{},hpej3rn,False,t3_rl6rkv,False,True,t3_rl6rkv,/r/FemaleLevelUpStrategy/comments/rl6rkv/sensitiveme_or_bullyfriend/hpej3rn/,1640075341,1,False,True,False,FemaleLevelUpStrategy,t5_2c0k6s,r/FemaleLevelUpStrategy,public,,0,[],
[],False,,cherry_lemonade1,,,[],,,,text,t2_hdycwkg6,False,False,Mine is working on my self love and confidence. It's never been good but took a massive blow a couple of months ago and I'm struggling so 2022 is my year to build that up,6a92291ec488f138347456eb0e5bbe653d69257b,True,False,,,,,0,1640074876,,0,{},hpeijp9,False,t3_rkv8t9,False,True,t3_rkv8t9,/r/FemaleLevelUpStrategy/comments/rkv8t9/goals_for_2022/hpeijp9/,1640074889,1,False,True,False,FemaleLevelUpStrategy,t5_2c0k6s,r/FemaleLevelUpStrategy,public,,0,[],
[],False,,cherry_lemonade1,,,[],,,,text,t2_hdycwkg6,False,False,"My grandmother once said to me ""you only fail if you don't even try, make mistakes, learn from them, grow from them because you never fail if you try"" she was a very successful woman and she said that ""failures"" are just learning points. You haven't failed you needed to take some time for your mental health and that is ok! Your still so young and have a lot of life in front of you get excited for your future in what you would like to do, so what it's been delayed a few years your still doing it!",1e04e20874d91b5e2802100d1f79b28543f732c4,True,False,,,,,0,1640074561,,0,{},hpei5qz,False,t3_rl5oze,False,True,t3_rl5oze,/r/FemaleLevelUpStrategy/comments/rl5oze/i_need_advice_on_how_to_cope_with_not_being_where/hpei5qz/,1640074575,1,False,True,False,FemaleLevelUpStrategy,t5_2c0k6s,r/FemaleLevelUpStrategy,public,,0,[],
[],False,,curlyhaiir,,,[],,,,text,t2_9zlwye6c,False,False,"Hi ♥️
Something traumatic happened to me as well when I was 19, a few months before I started college. I dropped out of college 2 years later and didn’t finish my degree. I was depressed and traumatized as hell and couldn’t pretend any longer that i am okay. What helped me was to find a therapist and a few months later I had the strength to start a new degree in management and pushed through. 
I got my bachelors degree, was able to intern in two prestigious companies where the latter even offered me a job. Despite this I am sometimes sad that my peers have already finished with their master degrees and / or started working already while it took me some time. 
A few months ago I declined a masters degree from a top European business school to take a break before starting my masters. I’m going weekly  to therapy and work part-time at my new job and moved back to my parents. I just needed that break and I know that despite the first therapy that my mental health isn’t exactly there where it needs to be and I still have some issues I need to work on. 

What I am trying to say is that breaks are OK, and baby steps are OK as well. Life is not linear. The most important thing is that you work on it and get the help you need. It’s never too late to start a degree or to pursue your dreams. 
When you are young it always feels like bad things that happen to us feel like the end of the world but it’s not true. Life offers us so many chances, there’s always a new beginning, a new career no matter how old you are or what happened to you. :)",201783facf4fe7418f4aacc431cf70e27cf09adf,True,False,,,,,0,1640073834,,0,{},hpeh976,False,t3_rl5oze,False,True,t3_rl5oze,/r/FemaleLevelUpStrategy/comments/rl5oze/i_need_advice_on_how_to_cope_with_not_being_where/hpeh976/,1640073844,1,False,True,False,FemaleLevelUpStrategy,t5_2c0k6s,r/FemaleLevelUpStrategy,public,,0,[],
[],False,,BansheeCon,,,[],,,,text,t2_6q5jcb8o,False,False,"Great thread - so many good ideas ❤️

I wanted to set a few different goals based on the wheel of life assessment (where you evaluate different  areas of your life and how satisfied you are with them). 

Mine are:

Financial: Save a fully-funded 6 month emergency fund (topping up what I have already by about 2000)

Personal Development: Write one short story a month and look for opportunities to get them published.

Career: Do one hour of reading or online courses per week to improve my skills.

Health: Get into the habit of working out 3-4x a week and taking 10000 steps a day. 

Environment: Keep making home improvements and aim to have all rooms in my house repainted by the end of the year. 

Family, Friends and Relationship: Plan more days out, dates and meet-ups (at least one a month for each group) and take more photos!",65b5e4467c3dbbea21eba26d3d93765a551fe689,True,False,,,,,0,1640073390,,0,{},hpegpit,False,t3_rkv8t9,False,True,t3_rkv8t9,/r/FemaleLevelUpStrategy/comments/rkv8t9/goals_for_2022/hpegpit/,1640073401,1,False,True,False,FemaleLevelUpStrategy,t5_2c0k6s,r/FemaleLevelUpStrategy,public,,0,[],
